{
  "$schema": "../../schemas/institutional_record.schema.json",
  "schema_version": "1.0.0",
  "record_class": "claim_ledger",
  "identifier": "BFC-CLAIMS-001",
  "status": "candidate",
  "authority_boundary": "Observed reference measurements are candidate software evidence and are not general scientific claims or mathematical certification.",
  "subject": {"repository": "grandchallenge/BUTTERFLY", "path": "VALIDATION.md", "commit": "PENDING_EXACT_CANDIDATE", "sha256": "PENDING_EXACT_CANDIDATE"},
  "evidence": ["tests/", "configs/", "artifacts/"],
  "claims": [
    {"claim": "Normalized Hadamard reference execution and adjoint satisfy the declared finite tests", "status": "candidate", "boundary": "Only exact tested sizes, dtype, implementation, commit, and recorded environment"},
    {"claim": "Sampled random dense controls are rejected under the declared small rank budget", "status": "candidate", "boundary": "Only frozen seeds, samples, sizes, estimator, tolerance, and rank budget"},
    {"claim": "A generic algebraic butterfly compiler is operational", "status": "rejected", "boundary": "WP3 is explicitly unimplemented and raises NotImplementedError"}
  ],
  "unresolved_obligations": ["Fresh clean-environment qualification", "Exact evidence manifest", "Independent review"]
}
