{
  "$schema": "../../schemas/institutional_record.schema.json",
  "schema_version": "1.0.0",
  "record_class": "programme",
  "identifier": "BFC-PROGRAMME-001",
  "status": "candidate",
  "authority_boundary": "Work-package state and bounded Referee-governed research results only; no certification, deployment, hardware, novelty, safety, manufacturing, product, or commercial authority.",
  "subject": {
    "repository": "grandchallenge/BUTTERFLY",
    "path": "docs/PROGRAMME_CHARTER.md",
    "commit": "PENDING_EXACT_CANDIDATE",
    "sha256": "PENDING_EXACT_CANDIDATE"
  },
  "evidence": ["PROGRAMME_SPEC.md", "ARCHITECTURE.md", "CONTRACTS.md", "WORK_BREAKDOWN.md"],
  "supersedes": null,
  "reversal_conditions": ["Reference baseline cannot be reproduced", "Required governance controls cannot be enforced", "Human Steward withholds public admission"],
  "unresolved_obligations": ["Independent Adversary finding", "Independent Referee finding", "Human Steward exact-packet authorization", "Protected cross-repository integration and public readback"]
}
